{
  "plugins": [
    {
      "name": "eslint-plugin-browser-security",
      "rules": 46,
      "description": "ESLint plugin for browser security — detects DOM XSS, postMessage abuse, tokens in localStorage, insecure cookies, clickjacking, mixed content, and CSP gaps",
      "category": "security",
      "version": "2.1.9",
      "published": true
    },
    {
      "name": "eslint-plugin-node-security",
      "rules": 43,
      "description": "ESLint plugin for Node.js security — detects command injection, path traversal, SSRF, zip slip, and weak crypto (MD5/SHA-1, ECB, static IV) in fs, child_process, vm, and crypto",
      "category": "security",
      "version": "5.6.12",
      "published": true
    },
    {
      "name": "eslint-plugin-secure-coding",
      "rules": 33,
      "description": "ESLint plugin for secure coding — detects LDAP, XPath, XXE, GraphQL and template injection, unsafe deserialization, ReDoS, missing authentication, and PII in logs",
      "category": "security",
      "version": "5.4.16",
      "published": true
    },
    {
      "name": "eslint-plugin-vercel-ai-security",
      "rules": 19,
      "description": "ESLint plugin for Vercel AI SDK security — detects prompt injection, system-prompt leaks, hardcoded API keys, and unvalidated model output in generateText and streamText",
      "category": "security",
      "version": "2.3.0",
      "published": true
    },
    {
      "name": "eslint-plugin-mongodb-security",
      "rules": 16,
      "description": "ESLint plugin for MongoDB and Mongoose security — detects NoSQL operator injection, unsafe queries and regex, hardcoded connection strings, and missing TLS",
      "category": "security",
      "version": "9.1.5",
      "published": true
    },
    {
      "name": "eslint-plugin-mcp-sdk-security",
      "rules": 15,
      "description": "ESLint plugin for Model Context Protocol (MCP) SDK security — follows tool arguments into shells, file paths, URLs, SQL and eval; catches credential leaks, untrusted text in model-facing descriptions and prompts, unhardened HTTP transports, shared stateless servers, predictable session ids, untrusted stdio commands and schema/handler drift",
      "category": "security",
      "version": "1.0.0",
      "published": true
    },
    {
      "name": "eslint-plugin-jwt-security",
      "rules": 13,
      "description": "ESLint plugin for JWT security — detects algorithm confusion (CVE-2022-23540), alg:none, weak or hardcoded secrets, and decode-without-verify",
      "category": "security",
      "version": "3.5.2",
      "published": true
    },
    {
      "name": "eslint-plugin-postgresql-security",
      "rules": 13,
      "description": "ESLint plugin for the pg PostgreSQL driver — detects SQL injection, unreleased clients, floating queries, unsafe search_path, and insecure SSL",
      "category": "security",
      "version": "2.6.2",
      "published": true
    },
    {
      "name": "eslint-plugin-knex-security",
      "rules": 5,
      "description": "ESLint plugin for knex — detects SQL injection in raw queries built with string concatenation or template literals, connection configuration that disables TLS or certificate validation, and hardcoded database credentials",
      "category": "security",
      "version": "1.0.0",
      "published": true
    },
    {
      "name": "eslint-plugin-drizzle-security",
      "rules": 4,
      "description": "ESLint plugin for drizzle-orm — detects SQL injection in raw queries built with string concatenation or template literals",
      "category": "security",
      "version": "1.0.0",
      "published": true
    },
    {
      "name": "eslint-plugin-prisma-security",
      "rules": 4,
      "description": "ESLint plugin for @prisma/client — detects SQL injection in raw queries built with string concatenation or template literals",
      "category": "security",
      "version": "1.0.0",
      "published": true
    },
    {
      "name": "eslint-plugin-sequelize-security",
      "rules": 4,
      "description": "ESLint plugin for the Sequelize ORM — detects SQL injection in raw sequelize.query() and Sequelize.literal() calls built with string concatenation or template literals, connection configuration that disables TLS or certificate validation, and hardcoded database credentials",
      "category": "security",
      "version": "1.0.0",
      "published": true
    },
    {
      "name": "eslint-plugin-supabase-security",
      "rules": 4,
      "description": "ESLint plugin for Supabase security — catches the service_role key reaching client code, RPC called with a computed function name, auth results whose error is discarded, and storage buckets created public",
      "category": "security",
      "version": "1.0.0",
      "published": true
    },
    {
      "name": "eslint-plugin-typeorm-security",
      "rules": 4,
      "description": "ESLint plugin for typeorm — detects SQL injection in raw queries built with string concatenation or template literals, connection configuration that disables TLS or certificate validation, and hardcoded database credentials",
      "category": "security",
      "version": "1.0.0",
      "published": true
    },
    {
      "name": "eslint-plugin-anthropic-security",
      "rules": 3,
      "description": "ESLint plugin for Anthropic SDK security — catches hardcoded Claude API keys, the browser escape hatch that ships them to every visitor, and system prompts assembled from untrusted input",
      "category": "security",
      "version": "1.0.0",
      "published": true
    },
    {
      "name": "eslint-plugin-gemini-security",
      "rules": 3,
      "description": "ESLint plugin for Google Gemini SDK security — catches safety thresholds set to BLOCK_NONE, hardcoded API keys, and system instructions assembled from untrusted input",
      "category": "security",
      "version": "1.0.0",
      "published": true
    },
    {
      "name": "eslint-plugin-mysql-security",
      "rules": 3,
      "description": "ESLint plugin for mysql2 / mysql — detects SQL injection in raw queries built with string concatenation or template literals, connection configuration that disables TLS or certificate validation, and hardcoded database credentials",
      "category": "security",
      "version": "1.0.0",
      "published": true
    },
    {
      "name": "eslint-plugin-openai-security",
      "rules": 3,
      "description": "ESLint plugin for OpenAI SDK security — catches dangerouslyAllowBrowser, hardcoded API keys, and system prompts assembled from untrusted input",
      "category": "security",
      "version": "1.0.0",
      "published": true
    },
    {
      "name": "eslint-plugin-sqlite-security",
      "rules": 1,
      "description": "ESLint plugin for better-sqlite3 / sqlite3 — detects SQL injection in raw queries built with string concatenation or template literals",
      "category": "security",
      "version": "1.0.0",
      "published": true
    },
    {
      "name": "eslint-plugin-express-security",
      "rules": 28,
      "description": "ESLint plugin for Express.js security — detects permissive CORS, missing CSRF protection, missing helmet headers, insecure cookies, and GraphQL introspection in production",
      "category": "framework",
      "version": "3.2.4",
      "published": true
    },
    {
      "name": "eslint-plugin-lambda-security",
      "rules": 14,
      "description": "ESLint plugin for AWS Lambda security — detects overly permissive IAM policies and CORS, unvalidated event bodies, secrets in env vars, and leaked error details",
      "category": "framework",
      "version": "2.1.5",
      "published": true
    },
    {
      "name": "eslint-plugin-nestjs-security",
      "rules": 10,
      "description": "ESLint plugin for NestJS security — detects missing auth guards, missing validation pipes, unthrottled routes, and exposed private fields",
      "category": "framework",
      "version": "3.1.3",
      "published": true
    },
    {
      "name": "eslint-plugin-import-next",
      "rules": 55,
      "description": "ESLint plugin for imports and module boundaries — drop-in replacement for eslint-plugin-import, 3.1x faster end-to-end, zero-config migration",
      "category": "architecture",
      "version": "2.8.13",
      "published": true
    },
    {
      "name": "eslint-plugin-conventions",
      "rules": 15,
      "description": "ESLint plugin for team code conventions — enforces filename case, magic-number bans, commented-out code, expiring TODOs, and deprecated-API usage",
      "category": "quality",
      "version": "6.0.8",
      "published": true
    },
    {
      "name": "eslint-plugin-maintainability",
      "rules": 12,
      "description": "ESLint plugin for maintainable code — limits cognitive complexity, nesting depth, parameter counts, duplicate functions, and unhandled or silent errors",
      "category": "quality",
      "version": "3.2.17",
      "published": true
    },
    {
      "name": "eslint-plugin-reliability",
      "rules": 9,
      "description": "ESLint plugin for runtime reliability — enforces error handling, network timeouts, null checks, and safe type narrowing",
      "category": "quality",
      "version": "4.1.12",
      "published": true
    },
    {
      "name": "eslint-plugin-modularity",
      "rules": 6,
      "description": "ESLint plugin for module architecture — enforces DDD value objects and anemic-model checks, naming, REST conventions, and utility isolation",
      "category": "quality",
      "version": "2.5.4",
      "published": true
    },
    {
      "name": "eslint-plugin-operability",
      "rules": 6,
      "description": "ESLint plugin for production operability — bans debug code and console logging in production, verbose error messages, and process.exit calls",
      "category": "quality",
      "version": "4.1.6",
      "published": true
    },
    {
      "name": "eslint-plugin-cli-floor",
      "rules": 4,